<?xml version="1.0"?>
<JukeboxPatch version="1.0"  xmlns="https://www.w3schools.com" xmlns:xsi="http://www.w3.org/2001/XMLSchema-instance" xsi:schemaLocation="file://patch.xsd">
    <DeviceNameInEnglish>
        Simple Instrument
    </DeviceNameInEnglish>
    <Properties deviceProductID="se.propellerheads.SimpleInstrument"  deviceVersion="1.0.0d1" >
        <Object name="custom_properties" >
            <Value property="volume"  type="number" >
                0.7
            </Value>
            <Value property="frequency"  type="number" >
                0
            </Value>
            <Value property="sampleplay"  type="boolean" >
                false
            </Value>
            <Value property="waveform"  type="number" >
                0
            </Value>
        </Object>
    </Properties>
</JukeboxPatch>

